title,url
Remote Fullstack Developer Internship At Kalam,https://bit.ly/3SsG2Oy
Remote Fullstack Developer Internship At Cuvette ,https://bit.ly/3Ou5ySD
Software Engineer - Java Hiring At JPMorgan Chase & Co.,https://bit.ly/3SpDRLQ
Engineering Intern Hiring At Target,https://bit.ly/49nWhDz
2024 RBCDSAI Summer Internship Application form,https://bit.ly/42tptXF
Data Analytics: Internship Opportunity At Microsoft,https://bit.ly/4bsZp2E
Associate Software Developer hiring at Sas,https://bit.ly/3OAHvRT
2024 Product Design Internship: India At Uber,https://bit.ly/42tOpOG
Saathi is hiring for the role of Mobile App Developer Intern!,https://bit.ly/42vVsGw
Frontend Developer Internship At Eight Network,https://bit.ly/3up39lf
UI/UX Designer Hiring At Target Technology,https://bit.ly/3uqShmU
Software Engineer (New graduates) Hiring At Sansan,https://bit.ly/3Sv0HSf
NatWest Group Is Hiring For Reactjs Development Intern ,https://bit.ly/485L35C
title,url
"Software Engineering Intern, Summer 2024 - Google",https://bit.ly/3SRY25t
Software Engineering - Fulltime Opportunities for University Graduates - Microsoft,https://bit.ly/42PiWGZ
"Work From Home Frontend Developer Internship At Trisetra, inc",https://bit.ly/3SHOWIq
"Work From Home Backend Developer Internship At Trisetra, inc",https://bit.ly/42DLlzE
title,url
Engineering Intern hiring at HomeLane,https://bit.ly/3urtBe5
Remote SDE Intern Opportunity At WebGo Software ,https://bit.ly/49d0iLm
"Technical Solutions Consultant Intern, Summer 2024 - Google",https://bit.ly/49b8efY
title,url
Software Engineer (Intern) - Summer 2024 At Acorns,https://bit.ly/49tfXG4
Frontend Engineer Intern At Zenskar, https://bit.ly/4bx2nmW
Discovery - Explorer Summer Internship Programme 2024 - Barclays,https://bit.ly/42Dublp
title,url
Thoughtspot Is Hiring Engineering Intern 2025,https://bit.ly/48f6Dol
Summer 2024 - Software Engineer Intern At Coinbase,https://bit.ly/3wmlik6
Zomato Is Hiring For SDE Intern,https://bit.ly/49uUo8b
title,url
Visa is hiring for Software Engineer Intern ,https://bit.ly/3uHGcK2
title,url
Fullstack Engineer Intern At Snowflake,https://bit.ly/3SGVRkL
Cadence is hiring for Software Engineering Intern,https://bit.ly/48lA3RH
Software Engineer Intern hirnig at Practo,https://bit.ly/3SYolb7
Software Engineer - Mercari/Merpay (Internship),https://bit.ly/3SHsPlb
title,url
CashKaro is hiring for Python Intern,https://bit.ly/49Fnge3
Software Developer Internship At Scalers.AI | Bangalore,https://bit.ly/3uLdFDr
title,url
Software Engineer-I Hiring At FICO,https://bit.ly/3ULryfw
Graduate Software Engineer Hiring At IMC,https://bit.ly/3I4PGSK
title,url
Frontend Engineer Opportunity At Fractal,https://bit.ly/4bJTg2y
Early Career Program: ASPIRE - Engineering and Technology (India) 2024,https://bit.ly/3T1LHwx
