title,url
Remote Fullstack Developer Internship At Kalam,https://bit.ly/3SsG2Oy
Remote Fullstack Developer Internship At Cuvette ,https://bit.ly/3Ou5ySD
Software Engineer - Java Hiring At JPMorgan Chase & Co.,https://bit.ly/3SpDRLQ
Engineering Intern Hiring At Target,https://bit.ly/49nWhDz
2024 RBCDSAI Summer Internship Application form,https://bit.ly/42tptXF
Data Analytics: Internship Opportunity At Microsoft,https://bit.ly/4bsZp2E
Associate Software Developer hiring at Sas,https://bit.ly/3OAHvRT
2024 Product Design Internship: India At Uber,https://bit.ly/42tOpOG
Saathi is hiring for the role of Mobile App Developer Intern!,https://bit.ly/42vVsGw
Frontend Developer Internship At Eight Network,https://bit.ly/3up39lf
UI/UX Designer Hiring At Target Technology,https://bit.ly/3uqShmU
Software Engineer (New graduates) Hiring At Sansan,https://bit.ly/3Sv0HSf
NatWest Group Is Hiring For Reactjs Development Intern ,https://bit.ly/485L35C
title,url
"Software Engineering Intern, Summer 2024 - Google",https://bit.ly/3SRY25t
Software Engineering - Fulltime Opportunities for University Graduates - Microsoft,https://bit.ly/42PiWGZ
"Work From Home Frontend Developer Internship At Trisetra, inc",https://bit.ly/3SHOWIq
"Work From Home Backend Developer Internship At Trisetra, inc",https://bit.ly/42DLlzE
title,url
Engineering Intern hiring at HomeLane,https://bit.ly/3urtBe5
Remote SDE Intern Opportunity At WebGo Software ,https://bit.ly/49d0iLm
"Technical Solutions Consultant Intern, Summer 2024 - Google",https://bit.ly/49b8efY
title,url
Software Engineer (Intern) - Summer 2024 At Acorns,https://bit.ly/49tfXG4
Frontend Engineer Intern At Zenskar, https://bit.ly/4bx2nmW
Discovery - Explorer Summer Internship Programme 2024 - Barclays,https://bit.ly/42Dublp
title,url
Thoughtspot Is Hiring Engineering Intern 2025,https://bit.ly/48f6Dol
Summer 2024 - Software Engineer Intern At Coinbase,https://bit.ly/3wmlik6
Zomato Is Hiring For SDE Intern,https://bit.ly/49uUo8b
title,url
Visa is hiring for Software Engineer Intern ,https://bit.ly/3uHGcK2
title,url
Fullstack Engineer Intern At Snowflake,https://bit.ly/3SGVRkL
Cadence is hiring for Software Engineering Intern,https://bit.ly/48lA3RH
Software Engineer Intern hirnig at Practo,https://bit.ly/3SYolb7
Software Engineer - Mercari/Merpay (Internship),https://bit.ly/3SHsPlb
title,url
CashKaro is hiring for Python Intern,https://bit.ly/49Fnge3
Software Developer Internship At Scalers.AI | Bangalore,https://bit.ly/3uLdFDr
title,url
Software Engineer-I Hiring At FICO,https://bit.ly/3ULryfw
Graduate Software Engineer Hiring At IMC,https://bit.ly/3I4PGSK
title,url
Frontend Engineer Opportunity At Fractal,https://bit.ly/4bJTg2y
Early Career Program: ASPIRE - Engineering and Technology (India) 2024,https://bit.ly/3T1LHwx
title,url
Software Engineer Intern At Meta,https://bit.ly/3uEMt9u
SDE Intern : Batch of 2024 hiring at CoinSwitch,https://bit.ly/3wmKPd4
title,url
Remote ReactJs Frontend Intern opening At Flabs ,https://bit.ly/3SNwJsK
"Global Internship Program (Onsite Tokyo, Japan) - HENNGE",https://bit.ly/49DyrUv
 Work from home Junior Full Stack Developer At Century Health,https://bit.ly/48pfxQe
title,url
Goldman Sachs Is Hiring For The Role Software Engineer ,https://bit.ly/49k0GYl
DevOps Engineer Internship At DataWeave,https://bit.ly/3wxVphl
BCG is Hiring Research Associates for BCG's DRS Team,https://bit.ly/3T6nchQ
Unstop Is Hiring !,https://bit.ly/49LMjfz
title,url
Remote Backend Developer Internship At Akto.io ,https://bit.ly/4bJqL4W
Remote Full Stack Engineer At Oasis of Ideas,https://bit.ly/3T4Lk4u
title,url
Software Development Engineer hiring at Western Digital ,https://bit.ly/42P2pm5
title,url
"Software Engineer - Python, ML, Automation At Synopsys",https://bit.ly/3wsVkvs
title,url
Remote Frontend Developer Internship At Enalo ,https://bit.ly/4bHkxCu
Software Development Engineer I Data At Meesho,https://bit.ly/3UV8CuS
Remote Web Developer Intern At VsCodeHelp,https://indeedhi.re/3STcjyB
Internship at lIT Hyderabad 2024,https://bit.ly/3IcYUwq
title,url
Summer Fellowship Programme - 2024 Indian Institute of Technology Madras,https://bit.ly/4bSKu1W
Software Engineer_Fresher (2023 Graduates) hiring at Amdocs,https://bit.ly/4bNHyno
Early Career Program: ASPIRE - Engineering and Technology (India) ,https://bit.ly/49tAudW
Remote FrontEnd Developer (A) hiring at Blue Coding,https://bit.ly/49I1PJP
title,url
Bain and Company is hiring for Associate Engineer ,https://bit.ly/430uhDZ
Software Development Engineer Hiring At GreyOrange,https://bit.ly/49vv5mE
OLA is hiring for Software Developer Intern ,https://bit.ly/3TcHBBN
Frontend Developer Internship At DataWeave ,https://bit.ly/3SU1EUj
Software Development Engineer role hiring at Fortinet,https://bit.ly/42WNHth
title,url
Remote Fullstack intern opening At Kalam,https://bit.ly/48AnPVx
title,url
Software Developer Internship At Ola ,https://bit.ly/3uQAupr
Software Engineer Intern opening at CM.com ,https://bit.ly/3TfIo4X
title,url
Software Developer Intern opening at Agilite,https://bit.ly/3uU6mcU
Micron Is Hiring for Application Software Engineer,https://bit.ly/3wBXglw
Backend Developer Job At ContractKen ,https://bit.ly/3IeIcgh
SDE Intern - Frontend (Web) @ Groww,https://bit.ly/3T0E4Fn
Software Engineer Intern Hiring At Qualcomm,https://careers.qualcomm.com/careers/job/446693743471
Associate Product Manager I at Meesho,https://bit.ly/49ECqAI
Microsoft is hiring fresher - SDE - 1,https://bit.ly/4bWA01A
title,url
"Software Engineer, Governance Hiring At OP Labs",https://bit.ly/48yGhxz
title,url
D. E. Shaw is Hiring For Software Development Role,https://bit.ly/48EpE3u
Machine Learning Engineer Internship At Smollan,https://bit.ly/49BKUbE
title,url
KoinX - Frontend Intern Hiring ,https://bit.ly/3v3gPm7
Software Engineer (Fresher Hiring) At Mitsogo,https://bit.ly/3uTt5Wt
Groww is hiring for SDE 1 for its App,https://bit.ly/435NUuf
title,url
Software Engineer is hiring for Autodesk,https://bit.ly/435we23
Remote Fullstack Developer Internship At SurgeGrowth.io,https://bit.ly/3T7QU4O
title,url
Bentley Systems is For Intern Role,https://bit.ly/3PaSilY
Swiggy is hiring for Associate Software Developer role,https://bit.ly/48L0Kj0
title,url
Machine Learning Engineer hiring at Google,https://bit.ly/438rjNO
Software Development Engineering Intern Hiring At Appleute,https://bit.ly/3IvbZ4u
title,url
Junior Software Engineer hiring at Entnt,https://bit.ly/4c9WFYi
Software Engineer (Product) At XSEED Education,https://www.linkedin.com/jobs/view/3846247573/
title,url
SWE - Frontend [New Grad] hiring at Alphablocks,https://bit.ly/3VdbJi6
Front End Development Hiring At Kalki AI,https://bit.ly/4c8Reca
Mobile App Development At MentorBoxx,https://bit.ly/49NIqa9
Backend developer Hiring At Mistral AI ,https://bit.ly/3TuMjv3
title,url
Flutter Internship At Triveous,https://bit.ly/48SeatF
Tech Intern Hiring At Philips,https://bit.ly/4a7L4HM
title,url
Software Engineer - Intern At Hypersonix Inc.,https://bit.ly/49R5Hbf
